eid,pid,id,lab,subject,dob,recording_date,probe_name,probe_type,dset_bwm,dset_rs,n_clusters_text,n_good_clusters,n_overall_clusters,n_spikes,n_trials,recording_length,recording_minutes,duration_seconds,n_cluster_region_labels,n_unique_regions,n_good_unique_regions,brain_region_acronyms,good_brain_region_acronyms,brain_regions_text,session_json_bytes
32d27583-56aa-4510-bc03-669036edad20,2e720cee-05cc-440e-a24b-13794b1ac01d,2e720cee-05cc-440e-a24b-13794b1ac01d,churchlandlab_ucla,UCLA033,2021-07-06,2022-02-24,probe00,3B2,true,false,"159 good, 1353 overall",159,1353,14237016,785,81 minutes,81,4867.195883591968,1353,11,9,CUN;CB;CENT3;arb;PB;uf;scp;MY;MV;IRN;GRN,CUN;CB;CENT3;uf;PB;scp;MV;IRN;GRN,"cerebellum, cuneiform nucleus, gigantocellular reticular nucleus, intermediate reticular nucleus, lobule iii, medial vestibular nucleus, parabrachial nucleus, superior cerebelar peduncles, uncinate fascicle, cb, cent3, cun, grn, irn, mv, pb, scp, uf",57252
5455a21c-1be7-4cae-ae8e-8853a8d5f55e,e96cbd77-5fdf-4a35-81f4-4a6361bded65,e96cbd77-5fdf-4a35-81f4-4a6361bded65,churchlandlab_ucla,UCLA033,2021-07-06,2022-02-17,probe00,3B2,true,false,"67 good, 798 overall",67,798,1893073,634,76 minutes,76,4618.443400217779,798,22,13,void;MOp1;MOp2/3;MOp5;MOs5;MOs6a;ACAd6a;ACAv6a;RSPv6a;RSPv6b;cing;ccb;CA3;alv;chpl;DG-sg;DG-mo;V3;MH;MD;LH;root,MOp2/3;MOp5;MOs5;MOs6a;ACAd6a;ACAv6a;RSPv6a;RSPv6b;cing;ccb;alv;CA3;DG-sg,"anterior cingulate area dorsal part layer 6a, anterior cingulate area ventral part 6a, dentate gyrus granule cell layer, field ca3, primary motor area layer 2/3, primary motor area layer 5, retrosplenial area ventral part layer 6a, retrosplenial area ventral part layer 6b, secondary motor area layer 5, secondary motor area layer 6a, alveus, cingulum bundle, corpus callosum body, acad6a, acav6a, ca3, dg-sg, mop2/3, mop5, mos5, mos6a, rspv6a, rspv6b, alv, ccb, cing",37521
111c1762-7908-47e0-9f40-2f2ee55b6505,eebcaf65-7fa4-4118-869d-a084e84530e2,eebcaf65-7fa4-4118-869d-a084e84530e2,churchlandlab_ucla,UCLA033,2021-07-06,2022-02-15,probe01,3B2,true,false,"220 good, 1412 overall",220,1412,11016359,724,76 minutes,76,4588.4349032408245,1412,17,15,VISam5;VISam6a;VISam6b;cing;fp;dhc;alv;ProS;SUB;NOT;SCig;SCiw;MB;MRN;RN;root;PPT,VISam5;VISam6a;VISam6b;cing;fp;dhc;ProS;SUB;MB;NOT;PPT;SCig;SCiw;MRN;RN,"anteromedial visual area layer 5, anteromedial visual area layer 6a, anteromedial visual area layer 6b, midbrain, midbrain reticular nucleus, nucleus of the optic tract, posterior pretectal nucleus, prosubiculum, red nucleus, subiculum, superior colliculus motor related intermediate gray layer, superior colliculus motor related intermediate white layer, cingulum bundle, corpus callosum posterior forceps, dorsal hippocampal commissure, mb, mrn, not, ppt, pros, rn, scig, sciw, sub, visam5, visam6a, visam6b, cing, dhc, fp",58376
3537d970-f515-4786-853f-23de525e110f,501ab543-9d02-4085-956d-22b9b3eeb543,501ab543-9d02-4085-956d-22b9b3eeb543,churchlandlab_ucla,UCLA034,2021-07-28,2022-01-28,probe00,3B2,true,false,"246 good, 1180 overall",246,1180,11993728,503,67 minutes,67,4038.8235718633714,1180,19,16,SSp-bfd2/3;SSp-bfd4;SSp-bfd5;SSp-bfd6a;SSp-bfd6b;or;ccs;alv;CA3;CA2;ZI;root;LGd-sh;LGd-co;LGv;IGL;TH;VPM;VPL,SSp-bfd2/3;SSp-bfd4;SSp-bfd5;SSp-bfd6a;SSp-bfd6b;or;ccs;CA3;LGd-sh;LGd-co;LGv;IGL;TH;VPM;VPL;ZI,"dorsal part of the lateral geniculate complex core, dorsal part of the lateral geniculate complex shell, field ca3, intergeniculate leaflet of the lateral geniculate complex, primary somatosensory area barrel field layer 2/3, primary somatosensory area barrel field layer 4, primary somatosensory area barrel field layer 5, primary somatosensory area barrel field layer 6a, primary somatosensory area barrel field layer 6b, thalamus, ventral part of the lateral geniculate complex, ventral posterolateral nucleus of the thalamus, ventral posteromedial nucleus of the thalamus, zona incerta, corpus callosum splenium, optic radiation, ca3, igl, lgd-co, lgd-sh, lgv, ssp-bfd2/3, ssp-bfd4, ssp-bfd5, ssp-bfd6a, ssp-bfd6b, th, vpl, vpm, zi, ccs, or",47962
ebc9392c-1ecb-4b4b-a545-4e3d70d23611,6358854e-51d2-47de-a278-5cbfd155feb6,6358854e-51d2-47de-a278-5cbfd155feb6,churchlandlab_ucla,UCLA034,2021-07-28,2022-01-26,probe00,3B2,true,false,"281 good, 1230 overall",281,1230,10712691,496,96 minutes,96,5816.598844825592,1230,13,13,MOs2/3;MOs5;MOs6a;PL6a;ACAd6a;ccg;ACAv6a;STR;ACAv6b;cing;SEZ;LSr;MS,MOs2/3;MOs5;MOs6a;ACAd6a;PL6a;ACAv6a;ACAv6b;cing;ccg;SEZ;STR;LSr;MS,"anterior cingulate area dorsal part layer 6a, anterior cingulate area ventral part 6a, anterior cingulate area ventral part 6b, lateral septal nucleus rostral (rostroventral) part, medial septal nucleus, prelimbic area layer 6a, secondary motor area layer 2/3, secondary motor area layer 5, secondary motor area layer 6a, striatum, cingulum bundle, genu of corpus callosum, subependymal zone, acad6a, acav6a, acav6b, lsr, mos2/3, mos5, mos6a, ms, pl6a, sez, str, ccg, cing",47939
8a3a0197-b40a-449f-be55-c00b23253bbf,a94a0023-d461-49fa-8cc6-032237039c27,a94a0023-d461-49fa-8cc6-032237039c27,churchlandlab_ucla,UCLA034,2021-07-28,2022-01-25,probe01,3B2,true,false,"207 good, 1405 overall",207,1405,11421887,417,90 minutes,90,5453.264590763289,1405,11,7,scwm;VISpm6a;fp;dhc;SUB;root;MB;SCig;SCiw;MRN;RN,dhc;SUB;SCig;MB;SCiw;MRN;RN,"midbrain, midbrain reticular nucleus, red nucleus, subiculum, superior colliculus motor related intermediate gray layer, superior colliculus motor related intermediate white layer, dorsal hippocampal commissure, mb, mrn, rn, scig, sciw, sub, dhc",51276
19b44992-d527-4a12-8bda-aa11379cb08c,c872ca65-8319-4901-856e-7dc507e2dd9c,c872ca65-8319-4901-856e-7dc507e2dd9c,churchlandlab_ucla,UCLA034,2021-07-28,2022-01-27,probe00,3B2,true,false,"61 good, 633 overall",61,633,1344713,436,102 minutes,102,6122.448708331926,633,12,7,MOs6a;MOs6b;cing;fa;SEZ;ACB;CP;STR;NDB;OLF;VL;LSr,cing;fa;CP;OLF;VL;STR;NDB,"caudoputamen, diagonal band nucleus, olfactory areas, striatum, cingulum bundle, corpus callosum anterior forceps, lateral ventricle, cp, ndb, olf, str, vl, cing, fa",28140
19b44992-d527-4a12-8bda-aa11379cb08c,f083fcd5-e456-433d-8aa5-6ace0a7ac170,f083fcd5-e456-433d-8aa5-6ace0a7ac170,churchlandlab_ucla,UCLA034,2021-07-28,2022-01-27,probe01,3B2,true,false,"232 good, 1542 overall",232,1542,9990399,436,102 minutes,102,6122.463124125209,1542,14,13,void;SCzo;SCsg;SCop;SCig;SCiw;MB;ICe;SAG;MRN;sctv;NLL;P;ll,void;SCsg;SCop;SCig;SCiw;MB;ICe;MRN;SAG;NLL;ll;sctv;P,"inferior colliculus external nucleus, midbrain, midbrain reticular nucleus, nucleus of the lateral lemniscus, nucleus sagulum, pons, superior colliculus motor related intermediate gray layer, superior colliculus motor related intermediate white layer, superior colliculus optic layer, superior colliculus superficial gray layer, lateral lemniscus, ventral spinocerebellar tract, void, ice, mb, mrn, nll, p, sag, scig, sciw, scop, scsg, ll, sctv, void",56026
8a3a0197-b40a-449f-be55-c00b23253bbf,f9d8aacd-b2a0-49f2-bd71-c2f5aadcfdd1,f9d8aacd-b2a0-49f2-bd71-c2f5aadcfdd1,churchlandlab_ucla,UCLA034,2021-07-28,2022-01-25,probe00,3B2,true,false,"166 good, 1011 overall",166,1011,6507995,417,90 minutes,90,5452.265580438155,1011,20,19,VISp4;VISp5;VISp6a;or;VISp6b;fp;alv;CA1;DG-mo;DG-sg;DG-po;POL;SNr;MRN;APN;bsc;fiber tracts;LP;MB;TH,VISp4;VISp5;VISp6a;or;VISp6b;fp;CA1;DG-mo;DG-sg;DG-po;bsc;fiber tracts;LP;POL;APN;TH;MRN;MB;SNr,"anterior pretectal nucleus, dentate gyrus granule cell layer, dentate gyrus molecular layer, dentate gyrus polymorph layer, field ca1, lateral posterior nucleus of the thalamus, midbrain, midbrain reticular nucleus, posterior limiting nucleus of the thalamus, primary visual area layer 4, primary visual area layer 5, primary visual area layer 6a, primary visual area layer 6b, substantia nigra reticular part, thalamus, brachium of the superior colliculus, corpus callosum posterior forceps, fiber tracts, optic radiation, apn, ca1, dg-mo, dg-po, dg-sg, lp, mb, mrn, pol, snr, th, visp4, visp5, visp6a, visp6b, bsc, fiber tracts, fp, or",39667
6f36868f-5cc1-450c-82fa-6b9829ce0cfe,54455bff-7afd-4a16-835f-f79b7c30bae9,54455bff-7afd-4a16-835f-f79b7c30bae9,churchlandlab_ucla,UCLA035,2021-07-28,2022-02-18,probe00,3B2,true,false,"21 good, 1555 overall",21,1555,1655903,1002,99 minutes,99,5959.584602894449,1555,14,7,void;RSPv6a;ccs;RSPv5;root;MH;RSPd1;RSPd5;RSPd6a;RSPd2/3;cing;dhc;FC;V3,void;RSPd1;RSPd2/3;RSPd5;RSPd6a;RSPv6a;root,"retrosplenial area dorsal part layer 1, retrosplenial area dorsal part layer 2/3, retrosplenial area dorsal part layer 5, retrosplenial area dorsal part layer 6a, retrosplenial area ventral part layer 6a, root, void, rspd1, rspd2/3, rspd5, rspd6a, rspv6a, root, void",63379
f99ac31f-171b-4208-a55d-5644c0ad51c3,6ad5a0a6-362a-4aec-8743-2e91469b0b62,6ad5a0a6-362a-4aec-8743-2e91469b0b62,churchlandlab_ucla,UCLA035,2021-07-28,2022-02-24,probe00,3B2,true,false,"312 good, 1273 overall",312,1273,9112543,748,94 minutes,94,5694.923624711071,1273,10,8,MOs5;MOs6a;PL6a;ILA5;ILA6a;ORBm6a;OLF;STR;DP;TTd,MOs6a;PL6a;ILA6a;ILA5;DP;TTd;OLF;STR,"dorsal peduncular area, infralimbic area layer 5, infralimbic area layer 6a, olfactory areas, prelimbic area layer 6a, secondary motor area layer 6a, striatum, taenia tecta dorsal part, dp, ila5, ila6a, mos6a, olf, pl6a, str, ttd",53716
f99ac31f-171b-4208-a55d-5644c0ad51c3,6e61f777-90b9-4656-af30-9ed54d426c5a,6e61f777-90b9-4656-af30-9ed54d426c5a,churchlandlab_ucla,UCLA035,2021-07-28,2022-02-24,probe01,3B2,true,false,"0 good, 305 overall",0,305,0,748,94 minutes,94,5694.923187546908,305,12,0,DG-mo;DG-sg;LH;PF;fr;Mmme;SUM;TH;SPA;SPFm;PH;HY,,,25062
6f36868f-5cc1-450c-82fa-6b9829ce0cfe,7c94d733-b913-4064-83f2-37422712204c,7c94d733-b913-4064-83f2-37422712204c,churchlandlab_ucla,UCLA035,2021-07-28,2022-02-18,probe01,3B2,true,false,"119 good, 1301 overall",119,1301,4669081,1002,99 minutes,99,5959.593184575704,1301,10,7,void;MOp2/3;MOp1;MOp5;CP;MOp6a;MOp6b;SSp-m6b;scwm;ccb,MOp1;MOp2/3;MOp5;MOp6a;scwm;ccb;CP,"caudoputamen, primary motor area layer 1, primary motor area layer 2/3, primary motor area layer 5, primary motor area layer 6a, corpus callosum body, supra-callosal cerebral white matter, cp, mop1, mop2/3, mop5, mop6a, ccb, scwm",58848
e2b845a1-e313-4a08-bc61-a5f662ed295e,80f6ffdd-f692-450f-ab19-cd6d45bfd73e,80f6ffdd-f692-450f-ab19-cd6d45bfd73e,churchlandlab_ucla,UCLA036,2021-07-28,2022-03-09,probe00,3B2,true,false,"155 good, 1091 overall",155,1091,6575880,476,96 minutes,96,5812.307328977511,1091,20,18,CA1;DG-mo;DG-sg;DG-po;root;bsc;fiber tracts;LP;POL;TH;APN;MB;MRN;VISa4;VISa5;VISa6a;VISa6b;or;fp;alv,DG-mo;DG-po;DG-sg;fiber tracts;LP;POL;APN;MB;TH;MRN;VISa5;VISa4;VISa6a;VISa6b;or;fp;alv;CA1,"anterior area layer 4, anterior area layer 5, anterior area layer 6a, anterior area layer 6b, anterior pretectal nucleus, dentate gyrus granule cell layer, dentate gyrus molecular layer, dentate gyrus polymorph layer, field ca1, lateral posterior nucleus of the thalamus, midbrain, midbrain reticular nucleus, posterior limiting nucleus of the thalamus, thalamus, alveus, corpus callosum posterior forceps, fiber tracts, optic radiation, apn, ca1, dg-mo, dg-po, dg-sg, lp, mb, mrn, pol, th, visa4, visa5, visa6a, visa6b, alv, fiber tracts, fp, or",43418
e2b845a1-e313-4a08-bc61-a5f662ed295e,ac839451-05bc-493e-b167-558b2b195baa,ac839451-05bc-493e-b167-558b2b195baa,churchlandlab_ucla,UCLA036,2021-07-28,2022-03-09,probe01,3B2,true,false,"149 good, 1590 overall",149,1590,6371614,476,96 minutes,96,5812.311493167973,1590,19,15,void;CA1;VISam1;VISam2/3;VISam4;VISam5;VISam6a;VISam6b;cing;fp;alv;DG-mo;bsc;APN;DG-sg;root;MB;MRN;scwm,void;VISam1;VISam2/3;VISam4;VISam5;VISam6a;VISam6b;cing;fp;CA1;DG-mo;DG-sg;bsc;APN;MRN,"anterior pretectal nucleus, anteromedial visual area layer 1, anteromedial visual area layer 2/3, anteromedial visual area layer 4, anteromedial visual area layer 5, anteromedial visual area layer 6a, anteromedial visual area layer 6b, dentate gyrus granule cell layer, dentate gyrus molecular layer, field ca1, midbrain reticular nucleus, brachium of the superior colliculus, cingulum bundle, corpus callosum posterior forceps, void, apn, ca1, dg-mo, dg-sg, mrn, visam1, visam2/3, visam4, visam5, visam6a, visam6b, bsc, cing, fp, void",57420
2bdf206a-820f-402f-920a-9e86cd5388a4,02cc03e4-8015-4050-bb42-6c832091febb,02cc03e4-8015-4050-bb42-6c832091febb,churchlandlab_ucla,UCLA037,2021-07-28,2022-02-02,probe00,3B2,true,false,"146 good, 947 overall",146,947,10084007,580,85 minutes,85,5109.222276089743,947,14,9,VISa5;VISa6a;VISa6b;cing;or;fp;CA1;DG-mo;DG-sg;fiber tracts;bsc;MB;APN;MRN,VISa5;VISa6a;or;CA1;DG-sg;DG-mo;bsc;APN;MRN,"anterior area layer 5, anterior area layer 6a, anterior pretectal nucleus, dentate gyrus granule cell layer, dentate gyrus molecular layer, field ca1, midbrain reticular nucleus, brachium of the superior colliculus, optic radiation, apn, ca1, dg-mo, dg-sg, mrn, visa5, visa6a, bsc, or",41017
bda2faf5-9563-4940-a80f-ce444259e47b,29418b18-4db6-436f-a85e-b0f1d38d2e62,29418b18-4db6-436f-a85e-b0f1d38d2e62,churchlandlab_ucla,UCLA037,2021-07-28,2022-02-10,probe00,3B2,true,false,"192 good, 1057 overall",192,1057,3962612,545,65 minutes,65,3946.051934083607,1057,7,5,void;VISp1;VISp2/3;VISp4;VISpl5;VISpl4;ENTm3,VISp2/3;VISp4;VISpl4;VISpl5;ENTm3,"entorhinal area medial part dorsal zone layer 3, posterolateral visual area layer 4, posterolateral visual area layer 5, primary visual area layer 2/3, primary visual area layer 4, entm3, visp2/3, visp4, vispl4, vispl5",43825
8d316998-28c3-4265-b029-e2ca82375b2f,5245b505-d0e7-4942-94d1-b33a084fab03,5245b505-d0e7-4942-94d1-b33a084fab03,churchlandlab_ucla,UCLA037,2021-07-28,2022-02-09,probe00,3B2,true,false,"229 good, 1012 overall",229,1012,5348636,610,67 minutes,67,4041.9285543977194,1012,5,5,void;MOp5;MOp2/3;MOs1;MOs2/3,void;MOs1;MOs2/3;MOp2/3;MOp5,"primary motor area layer 2/3, primary motor area layer 5, secondary motor area layer 1, secondary motor area layer 2/3, void, mop2/3, mop5, mos1, mos2/3, void",42209
2bdf206a-820f-402f-920a-9e86cd5388a4,afe87fbb-3a17-461f-b333-e22903f1d70d,afe87fbb-3a17-461f-b333-e22903f1d70d,churchlandlab_ucla,UCLA037,2021-07-28,2022-02-02,probe01,3B2,true,false,"230 good, 1100 overall",230,1100,9991924,580,85 minutes,85,5109.227885698875,1100,17,17,VISa5;VISa6a;or;VISa6b;ccs;alv;CA1;DG-mo;DG-sg;DG-po;MB;LP;Eth;TH;PoT;SPFp;ml,VISa5;VISa6a;VISa6b;or;ccs;alv;CA1;DG-mo;DG-sg;DG-po;LP;Eth;TH;PoT;SPFp;MB;ml,"anterior area layer 5, anterior area layer 6a, anterior area layer 6b, dentate gyrus granule cell layer, dentate gyrus molecular layer, dentate gyrus polymorph layer, ethmoid nucleus of the thalamus, field ca1, lateral posterior nucleus of the thalamus, midbrain, posterior triangular thalamic nucleus, subparafascicular nucleus parvicellular part, thalamus, alveus, corpus callosum splenium, medial lemniscus, optic radiation, ca1, dg-mo, dg-po, dg-sg, eth, lp, mb, pot, spfp, th, visa5, visa6a, visa6b, alv, ccs, ml, or",45764
fa8ad50d-76f2-45fa-a52f-08fe3d942345,e05af01e-8721-4ec7-8d0f-dc022b3bebc3,e05af01e-8721-4ec7-8d0f-dc022b3bebc3,churchlandlab_ucla,UCLA037,2021-07-28,2022-02-08,probe00,3B2,true,false,"8 good, 259 overall",8,259,116806,459,69 minutes,69,4157.420469628592,259,15,4,LSc;STR;SF;V3;PVT;CM;IAM;RH;RE;Xi;PVHd;TH;PVH;HY;AHN,PVT;RE;PVH;AHN,"anterior hypothalamic nucleus, nucleus of reuniens, paraventricular hypothalamic nucleus, paraventricular nucleus of the thalamus, ahn, pvh, pvt, re",17430
91bac580-76ed-41ab-ac07-89051f8d7f6e,6d9b6393-6729-4a15-ad08-c6838842a074,6d9b6393-6729-4a15-ad08-c6838842a074,churchlandlab_ucla,UCLA044,2021-10-19,2022-04-14,probe00,3B2,true,false,"78 good, 981 overall",78,981,3672107,699,85 minutes,85,5149.293387238267,981,20,11,void;VISp1;VISp2/3;VISp4;VISp5;VISp6a;VISp6b;fp;or;CA1;alv;DG-mo;ProS;DG-sg;MRN;bsc;SCig;MB;root;RR,VISp2/3;VISp4;VISp5;VISp6a;CA1;DG-mo;DG-sg;SCig;MB;MRN;RR,"dentate gyrus granule cell layer, dentate gyrus molecular layer, field ca1, midbrain, midbrain reticular nucleus, midbrain reticular nucleus retrorubral area, primary visual area layer 2/3, primary visual area layer 4, primary visual area layer 5, primary visual area layer 6a, superior colliculus motor related intermediate gray layer, ca1, dg-mo, dg-sg, mb, mrn, rr, scig, visp2/3, visp4, visp5, visp6a",44929
23c75e0b-05d8-452e-8efb-a3687ab94079,c64201ea-262e-45fe-8f41-5a074780cd59,c64201ea-262e-45fe-8f41-5a074780cd59,churchlandlab_ucla,UCLA044,2021-10-19,2022-04-22,probe00,3B2,true,false,"123 good, 657 overall",123,657,21110617,562,71 minutes,71,4306.073323556528,657,5,3,void;CUL4 5;CENT3;arb;cbc,void;CUL4 5;CENT3,"lobule iii, lobules iv-v, void, cent3, cul4 5, void",33022
dc962048-89bb-4e6a-96a9-b062a2be1426,53b3a7c6-ae42-49da-b69c-69e55a43a427,53b3a7c6-ae42-49da-b69c-69e55a43a427,churchlandlab_ucla,UCLA048,2021-12-14,2022-08-16,probe01,3B2,true,false,"65 good, 569 overall",65,569,2359817,458,65 minutes,65,3934.969996671126,569,17,11,VISa4;VISa5;VISa2/3;VISa6a;VISa6b;or;ccs;alv;CA1;DG-mo;DG-sg;DG-po;bsc;LP;POL;APN;MRN,VISa5;VISa6a;VISa6b;or;CA1;DG-mo;DG-sg;LP;POL;APN;MRN,"anterior area layer 5, anterior area layer 6a, anterior area layer 6b, anterior pretectal nucleus, dentate gyrus granule cell layer, dentate gyrus molecular layer, field ca1, lateral posterior nucleus of the thalamus, midbrain reticular nucleus, posterior limiting nucleus of the thalamus, optic radiation, apn, ca1, dg-mo, dg-sg, lp, mrn, pol, visa5, visa6a, visa6b, or",27206
dc962048-89bb-4e6a-96a9-b062a2be1426,ee3345e6-540d-4cea-9e4a-7f1b2fb9a4e4,ee3345e6-540d-4cea-9e4a-7f1b2fb9a4e4,churchlandlab_ucla,UCLA048,2021-12-14,2022-08-16,probe00,3B2,true,false,"97 good, 673 overall",97,673,4424830,458,65 minutes,65,3934.9640558666642,673,19,13,VISa2/3;VISa1;VISa4;VISa5;VISa6a;VISa6b;or;CA1;DG-mo;DG-sg;DG-po;root;fiber tracts;bsc;LP;POL;APN;alv;MRN,VISa2/3;VISa4;VISa5;VISa6a;or;CA1;DG-sg;DG-po;bsc;LP;POL;APN;MRN,"anterior area layer 2/3, anterior area layer 4, anterior area layer 5, anterior area layer 6a, anterior pretectal nucleus, dentate gyrus granule cell layer, dentate gyrus polymorph layer, field ca1, lateral posterior nucleus of the thalamus, midbrain reticular nucleus, posterior limiting nucleus of the thalamus, brachium of the superior colliculus, optic radiation, apn, ca1, dg-po, dg-sg, lp, mrn, pol, visa2/3, visa4, visa5, visa6a, bsc, or",30362
8a1cf4ef-06e3-4c72-9bc7-e1baa189841b,5544da75-8d34-47cb-9092-1f91e713e79c,5544da75-8d34-47cb-9092-1f91e713e79c,churchlandlab_ucla,UCLA049,2021-12-14,2022-08-12,probe01,3B2,true,false,"197 good, 1002 overall",197,1002,4514379,405,70 minutes,70,4209.298224589013,1002,19,16,VISp2/3;VISrl2/3;VISp1;VISrl4;VISal4;VISal5;VISal6a;fp;alv;AUDpo6a;AUDpo6b;or;ENTl3;ENTl5;ECT6a;ec;CA1;PERI6a;PERI5,VISrl4;VISal4;VISal5;VISal6a;AUDpo6a;AUDpo6b;or;fp;alv;CA1;ec;ECT6a;PERI6a;PERI5;ENTl5;ENTl3,"anterolateral visual area layer 4, anterolateral visual area layer 5, anterolateral visual area layer 6a, ectorhinal area/layer 6a, entorhinal area lateral part layer 3, entorhinal area lateral part layer 5, field ca1, perirhinal area layer 5, perirhinal area layer 6a, posterior auditory area layer 6a, posterior auditory area layer 6b, rostrolateral area layer 4, alveus, corpus callosum posterior forceps, external capsule, optic radiation, audpo6a, audpo6b, ca1, ect6a, entl3, entl5, peri5, peri6a, visal4, visal5, visal6a, visrl4, alv, ec, fp, or",39498
8a1cf4ef-06e3-4c72-9bc7-e1baa189841b,5e8ac11b-959a-49ab-a6a3-8a3397e1df0e,5e8ac11b-959a-49ab-a6a3-8a3397e1df0e,churchlandlab_ucla,UCLA049,2021-12-14,2022-08-12,probe00,3B2,true,false,"50 good, 541 overall",50,541,2513021,405,70 minutes,70,4209.292309019592,541,5,3,ccg;CP;MA;SI;ACB,CP;ACB;SI,"caudoputamen, nucleus accumbens, substantia innominata, acb, cp, si",24534
0841d188-8ef2-4f20-9828-76a94d5343a4,c6e294f7-5421-4697-8618-8ccc9b0269f6,c6e294f7-5421-4697-8618-8ccc9b0269f6,churchlandlab_ucla,UCLA049,2021-12-14,2022-08-02,probe00,3B2,true,false,"46 good, 728 overall",46,728,2373472,505,70 minutes,70,4221.177583083821,728,16,7,VISa5;VISa6a;VISa6b;or;ccs;alv;CA1;DG-mo;DG-sg;DG-po;fiber tracts;bsc;MB;LP;APN;MRN,or;CA1;DG-sg;DG-po;LP;APN;MRN,"anterior pretectal nucleus, dentate gyrus granule cell layer, dentate gyrus polymorph layer, field ca1, lateral posterior nucleus of the thalamus, midbrain reticular nucleus, optic radiation, apn, ca1, dg-po, dg-sg, lp, mrn, or",32982
0841d188-8ef2-4f20-9828-76a94d5343a4,dd75e810-a399-4364-9d4a-517312cf3010,dd75e810-a399-4364-9d4a-517312cf3010,churchlandlab_ucla,UCLA049,2021-12-14,2022-08-02,probe01,3B2,true,false,"82 good, 732 overall",82,732,3810005,505,70 minutes,70,4221.18566818424,732,18,11,VISa2/3;VISa4;VISa5;CA1;VISa6a;VISa6b;or;fp;DG-mo;APN;LP;DG-sg;DG-po;root;bsc;fiber tracts;POL;MB,VISa4;VISa5;VISa6a;DG-mo;root;bsc;fiber tracts;LP;POL;APN;MB,"anterior area layer 4, anterior area layer 5, anterior area layer 6a, anterior pretectal nucleus, dentate gyrus molecular layer, lateral posterior nucleus of the thalamus, midbrain, posterior limiting nucleus of the thalamus, brachium of the superior colliculus, fiber tracts, root, apn, dg-mo, lp, mb, pol, visa4, visa5, visa6a, bsc, fiber tracts, root",33122
687017d4-c9fc-458f-a7d5-0979fe1a7470,f68d9f26-ac40-4c67-9cbf-9ad1851292f7,f68d9f26-ac40-4c67-9cbf-9ad1851292f7,churchlandlab_ucla,UCLA052,2021-12-14,2022-07-12,probe00,3B2,true,false,"93 good, 914 overall",93,914,5572668,436,88 minutes,88,5281.653771343287,914,16,11,VISam4;VISam5;VISam2/3;VISam6a;DG-mo;VISam6b;or;fp;alv;CA1;MRN;APN;DG-sg;root;bsc;MB,VISam5;VISam6a;VISam6b;or;fp;CA1;DG-mo;DG-sg;bsc;APN;MRN,"anterior pretectal nucleus, anteromedial visual area layer 5, anteromedial visual area layer 6a, anteromedial visual area layer 6b, dentate gyrus granule cell layer, dentate gyrus molecular layer, field ca1, midbrain reticular nucleus, brachium of the superior colliculus, corpus callosum posterior forceps, optic radiation, apn, ca1, dg-mo, dg-sg, mrn, visam5, visam6a, visam6b, bsc, fp, or",37181
16693458-0801-4d35-a3f1-9115c7e5acfd,53ecbf4f-e0d8-4fe6-a852-8b934a37a1c2,53ecbf4f-e0d8-4fe6-a852-8b934a37a1c2,cortexlab,KS014,2019-04-30,2019-12-03,probe00,3B2,true,false,"188 good, 917 overall",188,917,10585220,531,48 minutes,48,2926.340515458656,917,8,7,SCsg;SCop;SCig;SCiw;RN;ml;MRN;MB,SCsg;SCig;SCiw;MB;MRN;RN;ml,"midbrain, midbrain reticular nucleus, red nucleus, superior colliculus motor related intermediate gray layer, superior colliculus motor related intermediate white layer, superior colliculus superficial gray layer, medial lemniscus, mb, mrn, rn, scig, sciw, scsg, ml",39119
e1931de1-cf7b-49af-af33-2ade15e8abe7,9150758e-1390-41d1-b426-96675e60dbea,9150758e-1390-41d1-b426-96675e60dbea,cortexlab,KS014,2019-04-30,2019-12-05,probe00,3B2,true,false,"57 good, 419 overall",57,419,3499461,688,61 minutes,61,3664.0002784831186,419,17,13,VISp1;VISp2/3;VISp4;VISp5;VISp6a;VISp6b;scwm;fp;dhc;POST;SUB;root;bsc;SCig;APN;MB;MRN,VISp1;VISp2/3;VISp4;VISp5;VISp6a;scwm;fp;SUB;root;SCig;MB;APN;MRN,"anterior pretectal nucleus, midbrain, midbrain reticular nucleus, primary visual area layer 1, primary visual area layer 2/3, primary visual area layer 4, primary visual area layer 5, primary visual area layer 6a, subiculum, superior colliculus motor related intermediate gray layer, corpus callosum posterior forceps, root, supra-callosal cerebral white matter, apn, mb, mrn, scig, sub, visp1, visp2/3, visp4, visp5, visp6a, fp, root, scwm",27852
16693458-0801-4d35-a3f1-9115c7e5acfd,b543e81e-4c8f-415e-82ec-631b177d19d2,b543e81e-4c8f-415e-82ec-631b177d19d2,cortexlab,KS014,2019-04-30,2019-12-03,probe01,3B2,true,false,"82 good, 995 overall",82,995,2387572,531,48 minutes,48,2926.3462977891804,995,20,13,VISpm1;VISpm2/3;RSPagl2/3;RSPagl5;RSPagl6a;RSPd6a;RSPv6a;RSPv5;RSPv2/3;RSPv1;void;SCzo;SCsg;SCop;SCig;SCiw;PAG;SCdg;SCdw;MRN,RSPagl5;RSPd6a;RSPv6a;RSPv5;RSPv2/3;RSPv1;SCzo;SCsg;SCig;SCiw;SCdg;SCdw;PAG,"periaqueductal gray, retrosplenial area dorsal part layer 6a, retrosplenial area lateral agranular part layer 5, retrosplenial area ventral part layer 1, retrosplenial area ventral part layer 2/3, retrosplenial area ventral part layer 5, retrosplenial area ventral part layer 6a, superior colliculus motor related deep gray layer, superior colliculus motor related deep white layer, superior colliculus motor related intermediate gray layer, superior colliculus motor related intermediate white layer, superior colliculus superficial gray layer, superior colliculus zonal layer, pag, rspagl5, rspd6a, rspv1, rspv2/3, rspv5, rspv6a, scdg, scdw, scig, sciw, scsg, sczo",43193
b9c205c3-feac-485b-a89d-afc96d9cb280,ea931b15-6214-4b80-8d88-7acbbe071bc0,ea931b15-6214-4b80-8d88-7acbbe071bc0,cortexlab,KS014,2019-04-30,2019-12-07,probe00,3B2,true,false,"97 good, 790 overall",97,790,6163377,657,59 minutes,59,3587.6158047005006,790,10,6,VISp6a;VISp6b;fp;POST;root;fiber tracts;SCig;SCiw;MRN;MB,fp;POST;SCig;SCiw;MB;MRN,"midbrain, midbrain reticular nucleus, postsubiculum, superior colliculus motor related intermediate gray layer, superior colliculus motor related intermediate white layer, corpus callosum posterior forceps, mb, mrn, post, scig, sciw, fp",38391
