eid,pid,id,lab,subject,dob,recording_date,probe_name,probe_type,dset_bwm,dset_rs,n_clusters_text,n_good_clusters,n_overall_clusters,n_spikes,n_trials,recording_length,recording_minutes,duration_seconds,n_cluster_region_labels,n_unique_regions,n_good_unique_regions,brain_region_acronyms,good_brain_region_acronyms,brain_regions_text,session_json_bytes
63c70ae8-4dfb-418b-b21b-f0b1e5fba6c9,83716e49-3026-41a3-b021-1a4b6362f433,83716e49-3026-41a3-b021-1a4b6362f433,steinmetzlab,NR_0019,2021-08-01,2022-05-03,probe01,3B2,true,false,"43 good, 515 overall",43,515,1176704,900,90 minutes,90,5453.190954007319,515,16,10,void;SSp-ll1;SSp-tr1;SSp-ul1;SSp-ll2/3;SSp-ul2/3;SSp-ul4;SSp-ul5;SSp-un5;SSp-un6a;SSp-bfd6b;SSp-bfd6a;scwm;ccb;CP;or,SSp-ll1;SSp-ll2/3;SSp-ul2/3;SSp-ul4;SSp-ul5;SSp-un5;SSp-un6a;SSp-bfd6a;ccb;or,"primary somatosensory area barrel field layer 6a, primary somatosensory area lower limb layer 1, primary somatosensory area lower limb layer 2/3, primary somatosensory area unassigned layer 5, primary somatosensory area unassigned layer 6a, primary somatosensory area upper limb layer 2/3, primary somatosensory area upper limb layer 4, primary somatosensory area upper limb layer 5, corpus callosum body, optic radiation, ssp-bfd6a, ssp-ll1, ssp-ll2/3, ssp-ul2/3, ssp-ul4, ssp-ul5, ssp-un5, ssp-un6a, ccb, or",37113
3e6a97d3-3991-49e2-b346-6948cb4580fb,0aafb6f1-6c10-4886-8f03-543988e02d9e,0aafb6f1-6c10-4886-8f03-543988e02d9e,steinmetzlab,NR_0020,2021-09-15,2022-05-08,probe00,3B2,true,false,"84 good, 1031 overall",84,1031,4352400,525,64 minutes,64,3846.982253978205,1031,17,12,void;VISam2/3;VISa2/3;VISa4;VISa5;VISa6a;DG-mo;VISam6b;or;fp;CA1;DG-sg;DG-po;MRN;root;APN;bsc,VISam2/3;VISa2/3;VISa4;VISa5;VISa6a;or;fp;CA1;DG-sg;DG-mo;APN;MRN,"anterior area layer 2/3, anterior area layer 4, anterior area layer 5, anterior area layer 6a, anterior pretectal nucleus, anteromedial visual area layer 2/3, dentate gyrus granule cell layer, dentate gyrus molecular layer, field ca1, midbrain reticular nucleus, corpus callosum posterior forceps, optic radiation, apn, ca1, dg-mo, dg-sg, mrn, visa2/3, visa4, visa5, visa6a, visam2/3, fp, or",42684
d901aff5-2250-467a-b4a1-0cb9729df9e2,12c0f3a9-518e-4dac-9651-5d95c2b4730f,12c0f3a9-518e-4dac-9651-5d95c2b4730f,steinmetzlab,NR_0020,2021-09-15,2022-05-11,probe01,3B2,true,false,"48 good, 696 overall",48,696,1579129,458,64 minutes,64,3865.6920742395355,696,11,5,VISp2/3;VISp4;VISp5;CA1;VISp6a;VISl6a;VISl6b;or;fp;alv;VISp1,VISp2/3;VISp5;VISl6a;alv;CA1,"field ca1, lateral visual area layer 6a, primary visual area layer 2/3, primary visual area layer 5, alveus, ca1, visl6a, visp2/3, visp5, alv",30404
d901aff5-2250-467a-b4a1-0cb9729df9e2,96c816ad-9a48-46a4-8a84-9a73cc153d69,96c816ad-9a48-46a4-8a84-9a73cc153d69,steinmetzlab,NR_0020,2021-09-15,2022-05-11,probe00,3B2,true,false,"167 good, 859 overall",167,859,6259541,458,64 minutes,64,3865.685369570319,859,15,12,DG-mo;bsc;TH;LP;SGN;PoT;MGm;void;cpd;SPFp;PIL;MB;MRN;SNc;SNr,TH;LP;SGN;PoT;MGm;void;PIL;SPFp;MB;MRN;SNc;SNr,"lateral posterior nucleus of the thalamus, medial geniculate complex medial part, midbrain, midbrain reticular nucleus, posterior intralaminar thalamic nucleus, posterior triangular thalamic nucleus, subparafascicular nucleus parvicellular part, substantia nigra compact part, substantia nigra reticular part, suprageniculate nucleus, thalamus, void, lp, mb, mgm, mrn, pil, pot, sgn, snc, snr, spfp, th, void",35410
3e6a97d3-3991-49e2-b346-6948cb4580fb,b976e816-bc24-42e3-adf4-2801f1a52657,b976e816-bc24-42e3-adf4-2801f1a52657,steinmetzlab,NR_0020,2021-09-15,2022-05-08,probe01,3B2,true,false,"70 good, 871 overall",70,871,2033788,525,64 minutes,64,3846.98414885307,871,11,10,DG-mo;CA3;DG-sg;CA1;TR;BLAp;CA2;alv;root;OLF;COApl,DG-mo;DG-sg;CA3;CA2;CA1;alv;root;BLAp;TR;COApl,"basolateral amygdalar nucleus posterior part, cortical amygdalar area posterior part lateral zone, dentate gyrus granule cell layer, dentate gyrus molecular layer, field ca1, field ca2, field ca3, postpiriform transition area, alveus, root, blap, ca1, ca2, ca3, coapl, dg-mo, dg-sg, tr, alv, root",37342
eacc49a9-f3a1-49f1-b87f-0972f90ee837,dac5defe-62b8-4cc0-96cb-b9f923957c7f,dac5defe-62b8-4cc0-96cb-b9f923957c7f,steinmetzlab,NR_0020,2021-09-15,2022-05-09,probe00,3B2,true,false,"207 good, 1487 overall",207,1487,10488131,817,77 minutes,77,4650.105592073513,1487,18,17,RSPagl5;RSPagl6a;RSPd6a;RSPv6a;RSPv5;RSPv2/3;RSPv1;void;SCzo;SCsg;SCop;SCig;SCiw;SCdg;SCdw;PAG;MRN;RN,RSPagl5;RSPagl6a;RSPd6a;RSPv6a;RSPv5;RSPv2/3;RSPv1;void;SCsg;SCop;SCig;SCiw;SCdg;SCdw;PAG;MRN;RN,"midbrain reticular nucleus, periaqueductal gray, red nucleus, retrosplenial area dorsal part layer 6a, retrosplenial area lateral agranular part layer 5, retrosplenial area lateral agranular part layer 6a, retrosplenial area ventral part layer 1, retrosplenial area ventral part layer 2/3, retrosplenial area ventral part layer 5, retrosplenial area ventral part layer 6a, superior colliculus motor related deep gray layer, superior colliculus motor related deep white layer, superior colliculus motor related intermediate gray layer, superior colliculus motor related intermediate white layer, superior colliculus optic layer, superior colliculus superficial gray layer, void, mrn, pag, rn, rspagl5, rspagl6a, rspd6a, rspv1, rspv2/3, rspv5, rspv6a, scdg, scdw, scig, sciw, scop, scsg, void",63347
eacc49a9-f3a1-49f1-b87f-0972f90ee837,e9cf749b-85dc-4b59-834b-325cec608c48,e9cf749b-85dc-4b59-834b-325cec608c48,steinmetzlab,NR_0020,2021-09-15,2022-05-09,probe01,3B2,true,false,"75 good, 1135 overall",75,1135,3284556,817,77 minutes,77,4650.102085384357,1135,10,8,CA1;DG-mo;CA3;CA2;CTXsp;alv;root;EPv;TR;BLAp,CA3;CA2;CA1;alv;root;CTXsp;EPv;TR,"cortical subplate, endopiriform nucleus ventral part, field ca1, field ca2, field ca3, postpiriform transition area, alveus, root, ca1, ca2, ca3, ctxsp, epv, tr, alv, root",51333
5b49aca6-a6f4-4075-931a-617ad64c219c,f84f36c9-88f8-4d80-ba34-7f7a2b254ece,f84f36c9-88f8-4d80-ba34-7f7a2b254ece,steinmetzlab,NR_0020,2021-09-15,2022-05-10,probe01,3B2,true,false,"49 good, 736 overall",49,736,1903227,773,77 minutes,77,4651.461878076074,736,10,10,DG-mo;CA3;CA1;TR;EPv;CA2;alv;ec;CTXsp;OLF,DG-mo;CA3;CA2;CA1;alv;ec;CTXsp;EPv;OLF;TR,"cortical subplate, dentate gyrus molecular layer, endopiriform nucleus ventral part, field ca1, field ca2, field ca3, olfactory areas, postpiriform transition area, alveus, external capsule, ca1, ca2, ca3, ctxsp, dg-mo, epv, olf, tr, alv, ec",38544
27ef44c0-acb2-4220-b776-477d0d5abd35,07c79864-6fff-4e72-9fce-1c982e3457f9,07c79864-6fff-4e72-9fce-1c982e3457f9,steinmetzlab,NR_0021,2021-11-12,2022-06-28,probe00,3B2,true,false,"45 good, 497 overall",45,497,1334065,593,79 minutes,79,4795.972571584236,497,13,8,cing;CA1;ccb;alv;CA2;CA3;root;LD;CL;MD;PCN;SMT;TH,CA1;CA2;CA3;LD;CL;MD;TH;SMT,"central lateral nucleus of the thalamus, field ca1, field ca2, field ca3, lateral dorsal nucleus of thalamus, mediodorsal nucleus of thalamus, submedial nucleus of the thalamus, thalamus, ca1, ca2, ca3, cl, ld, md, smt, th",27521
e0928e11-2b86-4387-a203-80c77fab5d52,799d899d-c398-4e81-abaf-1ef4b02d5475,799d899d-c398-4e81-abaf-1ef4b02d5475,steinmetzlab,NR_0021,2021-11-12,2022-07-08,probe01,3B2,true,false,"62 good, 723 overall",62,723,1717745,474,72 minutes,72,4334.121772433262,723,13,8,VISp4;VISp5;SUB;VISp6a;VISp6b;or;fp;dhc;alv;ProS;DG-mo;DG-sg;DG-po,VISp4;VISp5;VISp6a;SUB;ProS;DG-mo;DG-sg;DG-po,"dentate gyrus granule cell layer, dentate gyrus molecular layer, dentate gyrus polymorph layer, primary visual area layer 4, primary visual area layer 5, primary visual area layer 6a, prosubiculum, subiculum, dg-mo, dg-po, dg-sg, pros, sub, visp4, visp5, visp6a",32131
1ca83b26-30fc-4350-a616-c38b7d00d240,9486a103-c53e-4a60-b202-4efcc6278d44,9486a103-c53e-4a60-b202-4efcc6278d44,steinmetzlab,NR_0021,2021-11-12,2022-06-30,probe01,3B2,true,false,"7 good, 184 overall",7,184,338311,586,77 minutes,77,4669.672436458561,184,12,3,SSp-un1;void;SSp-un2/3;SSp-un4;SSp-bfd4;SSp-bfd5;SSp-n6a;SSs6b;SSs6a;ccb;VISC6b;VISC6a,SSp-n6a;SSs6b;SSs6a,"primary somatosensory area nose layer 6a, supplemental somatosensory area layer 6a, supplemental somatosensory area layer 6b, ssp-n6a, sss6a, sss6b",18711
27ef44c0-acb2-4220-b776-477d0d5abd35,d23dec01-b35e-4950-9afa-72a1b3e74148,d23dec01-b35e-4950-9afa-72a1b3e74148,steinmetzlab,NR_0021,2021-11-12,2022-06-28,probe01,3B2,true,false,"142 good, 776 overall",142,776,2740554,593,79 minutes,79,4795.973902467657,776,14,9,SSp-bfd4;SSp-bfd5;SSp-bfd6a;AIp6a;SSp-bfd6b;scwm;ccb;CP;void;PIR;ec;VISC6b;AIp6b;ee,SSp-bfd6a;ccb;CP;ec;VISC6b;AIp6b;AIp6a;ee;PIR,"agranular insular area posterior part layer 6a, agranular insular area posterior part layer 6b, caudoputamen, piriform area, primary somatosensory area barrel field layer 6a, visceral area layer 6b, corpus callosum body, corpus callosum extreme capsule, external capsule, aip6a, aip6b, cp, pir, ssp-bfd6a, visc6b, ccb, ec, ee",36535
1ca83b26-30fc-4350-a616-c38b7d00d240,f865ea6c-6288-4a77-9a94-ef740166e9c7,f865ea6c-6288-4a77-9a94-ef740166e9c7,steinmetzlab,NR_0021,2021-11-12,2022-06-30,probe00,3B2,true,false,"98 good, 484 overall",98,484,4302414,586,77 minutes,77,4669.674420610824,484,5,3,DG-mo;DG-sg;APN;MB;MRN,APN;MB;MRN,"anterior pretectal nucleus, midbrain, midbrain reticular nucleus, apn, mb, mrn",27149
e0928e11-2b86-4387-a203-80c77fab5d52,fdeff6df-7216-4b83-ab64-241e9fd173da,fdeff6df-7216-4b83-ab64-241e9fd173da,steinmetzlab,NR_0021,2021-11-12,2022-07-08,probe00,3B2,true,false,"30 good, 325 overall",30,325,1826888,474,72 minutes,72,4334.113197882718,325,13,9,void;VISp1;VISp2/3;VISp4;VISp5;VISp6a;VISp6b;scwm;fp;SCig;SCiw;MRN;MB,VISp2/3;VISp5;VISp6a;VISp6b;scwm;fp;SCig;SCiw;MRN,"midbrain reticular nucleus, primary visual area layer 2/3, primary visual area layer 5, primary visual area layer 6a, primary visual area layer 6b, superior colliculus motor related intermediate gray layer, superior colliculus motor related intermediate white layer, corpus callosum posterior forceps, supra-callosal cerebral white matter, mrn, scig, sciw, visp2/3, visp5, visp6a, visp6b, fp, scwm",20538
2d9bfc10-59fb-424a-b699-7c42f86c7871,00c425fd-ec3e-4cd2-b8af-c0bc0c4bdd44,00c425fd-ec3e-4cd2-b8af-c0bc0c4bdd44,steinmetzlab,NR_0024,2021-11-03,2023-02-03,probe00,3B2,true,false,"116 good, 1208 overall",116,1208,2353060,678,83 minutes,83,5007.223219061796,1208,22,20,SSp-bfd1;SSp-bfd2/3;SSp-bfd4;SSp-bfd5;SSs5;ENTl5;void;ENTl2;AUDd6a;ENTl6a;fp;or;SSs6a;AUDd6b;alv;CA1;ec;ECT6b;ECT6a;PERI6a;ENTl3;PIR,SSp-bfd2/3;SSp-bfd4;SSp-bfd5;SSs5;SSs6a;AUDd6a;AUDd6b;or;fp;CA1;alv;ec;ECT6b;ECT6a;PERI6a;ENTl6a;ENTl5;ENTl3;ENTl2;PIR,"dorsal auditory area layer 6a, dorsal auditory area layer 6b, ectorhinal area/layer 6a, ectorhinal area/layer 6b, entorhinal area lateral part layer 2, entorhinal area lateral part layer 3, entorhinal area lateral part layer 5, entorhinal area lateral part layer 6a, field ca1, perirhinal area layer 6a, piriform area, primary somatosensory area barrel field layer 2/3, primary somatosensory area barrel field layer 4, primary somatosensory area barrel field layer 5, supplemental somatosensory area layer 5, supplemental somatosensory area layer 6a, alveus, corpus callosum posterior forceps, external capsule, optic radiation, audd6a, audd6b, ca1, ect6a, ect6b, entl2, entl3, entl5, entl6a, peri6a, pir, ssp-bfd2/3, ssp-bfd4, ssp-bfd5, sss5, sss6a, alv, ec, fp, or",52574
7cc74598-9c1b-436b-84fa-0bf89f31adf6,27109779-1b15-4d74-893f-08216d231307,27109779-1b15-4d74-893f-08216d231307,steinmetzlab,NR_0024,2021-11-03,2023-02-01,probe00,3B2,true,false,"105 good, 1243 overall",105,1243,3053008,526,80 minutes,80,4847.018791843666,1243,12,9,VISp6a;RSPagl6a;RSPd6a;POST;void;bic;ICe;MB;MRN;PPN;PRNr;P,VISp6a;RSPagl6a;RSPd6a;POST;bic;MRN;ICe;PPN;PRNr,"inferior colliculus external nucleus, midbrain reticular nucleus, pedunculopontine nucleus, pontine reticular nucleus, postsubiculum, primary visual area layer 6a, retrosplenial area dorsal part layer 6a, retrosplenial area lateral agranular part layer 6a, brachium of the inferior colliculus, ice, mrn, post, ppn, prnr, rspagl6a, rspd6a, visp6a, bic",49123
f4eb56a4-8bf8-4bbc-a8f3-6e6535134bad,bef05a5c-68c3-4513-87c7-b3151c88da8e,bef05a5c-68c3-4513-87c7-b3151c88da8e,steinmetzlab,NR_0024,2021-11-03,2023-02-07,probe00,3B2,true,false,"91 good, 1539 overall",91,1539,1969349,558,81 minutes,81,4860.909318825223,1539,14,10,LGd-ip;LGd-co;LP;TH;PO;VPM;MB;PSTN;STN;ZI;root;nst;VPL;ml,LGd-ip;LGd-co;LP;TH;PO;VPM;VPL;ml;ZI;PSTN,"dorsal part of the lateral geniculate complex core, dorsal part of the lateral geniculate complex ipsilateral zone, lateral posterior nucleus of the thalamus, parasubthalamic nucleus, posterior complex of the thalamus, thalamus, ventral posterolateral nucleus of the thalamus, ventral posteromedial nucleus of the thalamus, zona incerta, medial lemniscus, lgd-co, lgd-ip, lp, po, pstn, th, vpl, vpm, zi, ml",58642
7cc74598-9c1b-436b-84fa-0bf89f31adf6,bf827e50-eed3-4984-908e-c48ffbeae7b5,bf827e50-eed3-4984-908e-c48ffbeae7b5,steinmetzlab,NR_0024,2021-11-03,2023-02-01,probe01,3B2,true,false,"72 good, 1503 overall",72,1503,1187542,526,80 minutes,80,4847.024253774382,1503,9,9,void;VISrl1;VISal1;VISal2/3;AUDd2/3;AUDpo2/3;AUDpo4;AUDp4;AUDp5,void;VISrl1;VISal1;VISal2/3;AUDd2/3;AUDpo2/3;AUDpo4;AUDp4;AUDp5,"anterolateral visual area layer 1, anterolateral visual area layer 2/3, dorsal auditory area layer 2/3, posterior auditory area layer 2/3, posterior auditory area layer 4, primary auditory area layer 4, primary auditory area layer 5, rostrolateral area layer 1, void, audd2/3, audp4, audp5, audpo2/3, audpo4, visal1, visal2/3, visrl1, void",54932
3bcb81b4-d9ca-4fc9-a1cd-353a966239ca,cc701ed3-84b6-4b8e-8390-2e3f54414b19,cc701ed3-84b6-4b8e-8390-2e3f54414b19,steinmetzlab,NR_0024,2021-11-03,2023-01-19,probe01,3B2,true,false,"53 good, 787 overall",53,787,5923016,664,109 minutes,109,6546.973791515892,787,18,8,VISam1;VISam2/3;VISa2/3;VISa4;VISa5;VISa6a;VISam6a;cing;fp;CA1;DG-mo;DG-sg;DG-po;root;bsc;APN;MB;MRN,VISam6a;VISa6a;CA1;DG-sg;DG-po;APN;MB;MRN,"anterior area layer 6a, anterior pretectal nucleus, anteromedial visual area layer 6a, dentate gyrus granule cell layer, dentate gyrus polymorph layer, field ca1, midbrain, midbrain reticular nucleus, apn, ca1, dg-po, dg-sg, mb, mrn, visa6a, visam6a",38387
3bcb81b4-d9ca-4fc9-a1cd-353a966239ca,d004f105-9886-4b83-a59a-f9173131a383,d004f105-9886-4b83-a59a-f9173131a383,steinmetzlab,NR_0024,2021-11-03,2023-01-19,probe00,3B2,true,false,"76 good, 909 overall",76,909,4726978,664,109 minutes,109,6546.9712497754435,909,16,11,VISam2/3;VISam4;VISam5;VISam6a;VISam6b;scwm;fp;alv;CA1;DG-mo;NOT;MB;MRN;root;APN;RN,VISam4;VISam5;VISam6a;VISam6b;scwm;CA1;DG-mo;APN;MB;MRN;RN,"anterior pretectal nucleus, anteromedial visual area layer 4, anteromedial visual area layer 5, anteromedial visual area layer 6a, anteromedial visual area layer 6b, dentate gyrus molecular layer, field ca1, midbrain, midbrain reticular nucleus, red nucleus, supra-callosal cerebral white matter, apn, ca1, dg-mo, mb, mrn, rn, visam4, visam5, visam6a, visam6b, scwm",42084
f4eb56a4-8bf8-4bbc-a8f3-6e6535134bad,e5bd461c-a713-4b3c-b165-a132a711e59d,e5bd461c-a713-4b3c-b165-a132a711e59d,steinmetzlab,NR_0024,2021-11-03,2023-02-07,probe01,3B2,true,false,"63 good, 673 overall",63,673,1250146,558,81 minutes,81,4860.916496429422,673,10,7,scwm;ccb;or;CP;LA;amc;AIp6b;EPd;PIR;ee,scwm;ccb;CP;LA;EPd;ee;PIR,"caudoputamen, endopiriform nucleus dorsal part, lateral amygdalar nucleus, piriform area, corpus callosum body, corpus callosum extreme capsule, supra-callosal cerebral white matter, cp, epd, la, pir, ccb, ee, scwm",32263
ae8787b1-4229-4d56-b0c2-566b61a25b77,06cb2ee3-0fb8-4ace-acbe-19c716f3ca40,06cb2ee3-0fb8-4ace-acbe-19c716f3ca40,steinmetzlab,NR_0027,2022-03-03,2022-08-23,probe00,3B2,true,false,"84 good, 871 overall",84,871,2347486,885,91 minutes,91,5518.6104211164575,871,13,11,MOs6a;cing;MOs6b;ccg;CP;PS;VL;BST;AVP;MPO;LSv;STR;HY,MOs6a;cing;ccg;CP;LSv;STR;BST;PS;HY;MPO;AVP,"anteroventral preoptic nucleus, bed nuclei of the stria terminalis, caudoputamen, hypothalamus, lateral septal nucleus ventral part, medial preoptic area, parastrial nucleus, secondary motor area layer 6a, striatum, cingulum bundle, genu of corpus callosum, avp, bst, cp, hy, lsv, mos6a, mpo, ps, str, ccg, cing",44611
0f77ca5d-73c2-45bd-aa4c-4c5ed275dbde,1ab86a7f-578b-4a46-9c9c-df3be97abcca,1ab86a7f-578b-4a46-9c9c-df3be97abcca,steinmetzlab,NR_0027,2022-03-03,2022-08-22,probe00,3B2,true,false,"92 good, 821 overall",92,821,5343503,1191,112 minutes,112,6754.414104335652,821,13,9,MOs6a;ACAd6a;PL6a;PL6b;cing;ccg;fa;SEZ;VL;LSr;STR;LSv;ACB,MOs6a;ACAd6a;PL6a;PL6b;ccg;LSr;LSv;STR;ACB,"anterior cingulate area dorsal part layer 6a, lateral septal nucleus rostral (rostroventral) part, lateral septal nucleus ventral part, nucleus accumbens, prelimbic area layer 6a, prelimbic area layer 6b, secondary motor area layer 6a, striatum, genu of corpus callosum, acad6a, acb, lsr, lsv, mos6a, pl6a, pl6b, str, ccg",50937
ae8787b1-4229-4d56-b0c2-566b61a25b77,310c60b6-d68f-4018-a86a-3668ce296837,310c60b6-d68f-4018-a86a-3668ce296837,steinmetzlab,NR_0027,2022-03-03,2022-08-23,probe01,3B2,true,false,"117 good, 868 overall",117,868,2886078,885,91 minutes,91,5518.610949954422,868,13,9,void;MOs1;MOs2/3;MOs5;MOp5;MOp6a;MOp6b;CP;scwm;fa;AIv6a;CLA;EPd,MOs2/3;MOs5;MOp5;MOp6a;MOp6b;CP;AIv6a;CLA;EPd,"agranular insular area ventral part layer 6a, caudoputamen, claustrum, endopiriform nucleus dorsal part, primary motor area layer 5, primary motor area layer 6a, primary motor area layer 6b, secondary motor area layer 2/3, secondary motor area layer 5, aiv6a, cla, cp, epd, mop5, mop6a, mop6b, mos2/3, mos5",45104
6c6b0d06-6039-4525-a74b-58cfaa1d3a60,3fded122-619c-4e65-aadd-d5420978d167,3fded122-619c-4e65-aadd-d5420978d167,steinmetzlab,NR_0027,2022-03-03,2022-08-19,probe00,3B2,true,false,"77 good, 1023 overall",77,1023,6685696,1006,106 minutes,106,6384.59631733255,1023,17,14,VISam4;VISam5;VISam6a;VISam6b;fp;cing;scwm;alv;CA1;DG-mo;DG-sg;MRN;RN;APN;bsc;MB;root,VISam4;VISam5;VISam6a;VISam6b;scwm;fp;alv;CA1;DG-sg;DG-mo;MB;APN;MRN;RN,"anterior pretectal nucleus, anteromedial visual area layer 4, anteromedial visual area layer 5, anteromedial visual area layer 6a, anteromedial visual area layer 6b, dentate gyrus granule cell layer, dentate gyrus molecular layer, field ca1, midbrain, midbrain reticular nucleus, red nucleus, alveus, corpus callosum posterior forceps, supra-callosal cerebral white matter, apn, ca1, dg-mo, dg-sg, mb, mrn, rn, visam4, visam5, visam6a, visam6b, alv, fp, scwm",53211
195443eb-08e9-4a18-a7e1-d105b2ce1429,4d2e7e49-5b08-4914-afa6-fd311d957082,4d2e7e49-5b08-4914-afa6-fd311d957082,steinmetzlab,NR_0027,2022-03-03,2022-08-20,probe00,3B2,true,false,"10 good, 358 overall",10,358,197783,1037,116 minutes,116,6973.310827187577,358,11,4,DG-mo;bsc;MRN;MB;LP;APN;VTA;ml;mp;Mml;SUM,APN;MRN;VTA;SUM,"anterior pretectal nucleus, midbrain reticular nucleus, supramammillary nucleus, ventral tegmental area, apn, mrn, sum, vta",33515
6c6b0d06-6039-4525-a74b-58cfaa1d3a60,6bd246d2-b2c2-4a88-ac44-1a3e0facbaee,6bd246d2-b2c2-4a88-ac44-1a3e0facbaee,steinmetzlab,NR_0027,2022-03-03,2022-08-19,probe01,3B2,true,false,"60 good, 540 overall",60,540,5833501,1006,106 minutes,106,6384.60087170094,540,18,13,VISa5;VISa6a;VISa6b;or;ccs;alv;CA1;DG-mo;APN;DG-sg;DG-po;root;bsc;LP;MRN;MB;ml;VTA,VISa6a;or;ccs;CA1;DG-mo;DG-sg;DG-po;root;LP;APN;MRN;MB;ml,"anterior area layer 6a, anterior pretectal nucleus, dentate gyrus granule cell layer, dentate gyrus molecular layer, dentate gyrus polymorph layer, field ca1, lateral posterior nucleus of the thalamus, midbrain, midbrain reticular nucleus, corpus callosum splenium, medial lemniscus, optic radiation, root, apn, ca1, dg-mo, dg-po, dg-sg, lp, mb, mrn, visa6a, ccs, ml, or, root",38502
0f77ca5d-73c2-45bd-aa4c-4c5ed275dbde,eb7e9f3f-b79d-4cdd-bc24-b13a4008c1b5,eb7e9f3f-b79d-4cdd-bc24-b13a4008c1b5,steinmetzlab,NR_0027,2022-03-03,2022-08-22,probe01,3B2,true,false,"190 good, 986 overall",190,986,5428836,1191,112 minutes,112,6754.424998531728,986,7,6,AId6a;AId5;AIv5;PIR;AIv2/3;MOs5;MOs6a,AId6a;AId5;AIv5;AIv2/3;PIR;MOs6a,"agranular insular area dorsal part layer 5, agranular insular area dorsal part layer 6a, agranular insular area ventral part layer 2/3, agranular insular area ventral part layer 5, piriform area, secondary motor area layer 6a, aid5, aid6a, aiv2/3, aiv5, mos6a, pir",55773
f56194bc-8215-4ae8-bc6a-89781ad8e050,18d316bf-d322-4c5c-814e-a58147f7bf5f,18d316bf-d322-4c5c-814e-a58147f7bf5f,steinmetzlab,NR_0028,2022-06-08,2023-03-15,probe01,3B2,true,false,"83 good, 886 overall",83,886,2975429,696,86 minutes,86,5161.663432704697,886,15,7,VISp1;VISp2/3;VISp4;VISp5;VISp6a;VISal6a;VISal6b;or;fp;alv;CA1;DG-mo;DG-sg;CA3;DG-po,VISp5;VISp6a;CA1;DG-mo;DG-sg;DG-po;CA3,"dentate gyrus granule cell layer, dentate gyrus molecular layer, dentate gyrus polymorph layer, field ca1, field ca3, primary visual area layer 5, primary visual area layer 6a, ca1, ca3, dg-mo, dg-po, dg-sg, visp5, visp6a",41738
5c0c560e-9e1f-45e9-b66e-e4ee7855be84,478de1ce-d7e7-4221-9365-2abdc6e88fb6,478de1ce-d7e7-4221-9365-2abdc6e88fb6,steinmetzlab,NR_0028,2022-06-08,2023-03-07,probe00,3B2,true,false,"156 good, 1531 overall",156,1531,8998105,1100,109 minutes,109,6561.376186268577,1531,22,16,void;VISpm2/3;VISpm1;VISpm4;VISpm5;VISp5;VISp6a;VISp6b;scwm;fp;dhc;alv;SUB;SCig;SCiw;HPF;MRN;MB;PRNr;PPN;root;RR,VISpm1;VISpm2/3;VISpm4;VISpm5;VISp5;VISp6a;VISp6b;scwm;fp;dhc;SUB;SCig;SCiw;MB;MRN;PPN,"midbrain, midbrain reticular nucleus, pedunculopontine nucleus, primary visual area layer 5, primary visual area layer 6a, primary visual area layer 6b, subiculum, superior colliculus motor related intermediate gray layer, superior colliculus motor related intermediate white layer, corpus callosum posterior forceps, dorsal hippocampal commissure, posteromedial visual area layer 1, posteromedial visual area layer 2/3, posteromedial visual area layer 4, posteromedial visual area layer 5, supra-callosal cerebral white matter, mb, mrn, ppn, scig, sciw, sub, visp5, visp6a, visp6b, vispm1, vispm2/3, vispm4, vispm5, dhc, fp, scwm",71010
28338153-4113-485b-835b-91cb96d984f2,697d9e03-edc6-430a-ae76-94628c510161,697d9e03-edc6-430a-ae76-94628c510161,steinmetzlab,NR_0028,2022-06-08,2023-03-10,probe00,3B2,true,false,"112 good, 1035 overall",112,1035,4193832,906,90 minutes,90,5444.382378337114,1035,17,14,RSPagl5;RSPagl6a;RSPd6a;RSPd6b;cing;RSPv6a;RSPv5;RSPv2/3;RSPv1;root;MB;NOT;PPT;SCig;SCiw;NPC;PAG,RSPagl5;RSPagl6a;RSPd6a;cing;RSPv6a;RSPv5;RSPv2/3;RSPv1;root;MB;NOT;PPT;NPC;PAG,"midbrain, nucleus of the optic tract, nucleus of the posterior commissure, periaqueductal gray, posterior pretectal nucleus, retrosplenial area dorsal part layer 6a, retrosplenial area lateral agranular part layer 5, retrosplenial area lateral agranular part layer 6a, retrosplenial area ventral part layer 1, retrosplenial area ventral part layer 2/3, retrosplenial area ventral part layer 5, retrosplenial area ventral part layer 6a, cingulum bundle, root, mb, not, npc, pag, ppt, rspagl5, rspagl6a, rspd6a, rspv1, rspv2/3, rspv5, rspv6a, cing, root",51998
29a6def1-fc5c-4eea-ac48-47e9b053dcb5,81ef1ec7-dbcc-410f-9bff-b21a62a909fd,81ef1ec7-dbcc-410f-9bff-b21a62a909fd,steinmetzlab,NR_0028,2022-06-08,2023-03-14,probe00,3B2,true,false,"144 good, 1274 overall",144,1274,11478463,834,88 minutes,88,5311.950194194729,1274,18,13,RSPagl2/3;RSPagl5;RSPagl6a;RSPagl6b;cing;fp;dhc;HPF;SUB;root;MB;NOT;PPT;SCig;SCiw;MRN;RN;tspc,RSPagl2/3;RSPagl5;RSPagl6a;fp;dhc;SUB;root;NOT;PPT;MB;SCiw;MRN;RN,"midbrain, midbrain reticular nucleus, nucleus of the optic tract, posterior pretectal nucleus, red nucleus, retrosplenial area lateral agranular part layer 2/3, retrosplenial area lateral agranular part layer 5, retrosplenial area lateral agranular part layer 6a, subiculum, superior colliculus motor related intermediate white layer, corpus callosum posterior forceps, dorsal hippocampal commissure, root, mb, mrn, not, ppt, rn, rspagl2/3, rspagl5, rspagl6a, sciw, sub, dhc, fp, root",56951
c958919c-2e75-435d-845d-5b62190b520e,cc72fdb7-92e8-47e6-9cea-94f27c0da2d8,cc72fdb7-92e8-47e6-9cea-94f27c0da2d8,steinmetzlab,NR_0028,2022-06-08,2023-03-20,probe00,3B2,true,false,"144 good, 1487 overall",144,1487,9427471,788,88 minutes,88,5285.96796525745,1487,10,9,PAG;PCG;LDT;PDTg;NI;GRN;MY;mlf;tspc;P,PAG;LDT;PCG;PDTg;NI;GRN;MY;mlf;tspc,"gigantocellular reticular nucleus, laterodorsal tegmental nucleus, medulla, nucleus incertus, periaqueductal gray, pontine central gray, posterodorsal tegmental nucleus, crossed tectospinal pathway, medial longitudinal fascicle, grn, ldt, my, ni, pag, pcg, pdtg, mlf, tspc",62430
5c0c560e-9e1f-45e9-b66e-e4ee7855be84,d5e5311c-8beb-4f8f-b798-3e9bfa6bcdd8,d5e5311c-8beb-4f8f-b798-3e9bfa6bcdd8,steinmetzlab,NR_0028,2022-06-08,2023-03-07,probe01,3B2,true,false,"121 good, 1431 overall",121,1431,7610410,1100,109 minutes,109,6561.380308463744,1431,21,13,VISp1;VISp2/3;VISp4;VISp5;VISp6a;VISp6b;or;fp;dhc;ProS;alv;SUB;DG-mo;root;MRN;MB;SCiw;SCig;fiber tracts;bsc;RN,VISp2/3;VISp4;VISp5;or;ProS;SUB;root;fiber tracts;SCig;SCiw;MB;MRN;RN,"midbrain, midbrain reticular nucleus, primary visual area layer 2/3, primary visual area layer 4, primary visual area layer 5, prosubiculum, red nucleus, subiculum, superior colliculus motor related intermediate gray layer, superior colliculus motor related intermediate white layer, fiber tracts, optic radiation, root, mb, mrn, pros, rn, scig, sciw, sub, visp2/3, visp4, visp5, fiber tracts, or, root",67908
